{"basket":{"invoice_value_gbp":[63.36,150.32,301.23,484.4,905.56,4103.92],"lines_per_invoice":[2.0,6.0,15.0,29.0,52.0,198.0],"quantile_levels":[0.1,0.25,0.5,0.75,0.9,0.99]},"countries":[{"country":"United Kingdom","customers":5410,"invoices":49108,"net_gbp":15986060.34,"share":0.8478179717075515},{"country":"EIRE","customers":5,"invoices":806,"net_gbp":609953.78,"share":0.03234879424282744},{"country":"Netherlands","customers":23,"invoices":250,"net_gbp":548330.7,"share":0.02908062475049432},{"country":"Germany","customers":107,"invoices":1095,"net_gbp":411959.16,"share":0.021848183538819715},{"country":"France","customers":95,"invoices":746,"net_gbp":321733.39,"share":0.01706307522867944},{"country":"Australia","customers":15,"invoices":117,"net_gbp":166444.42,"share":0.008827351304301718},{"country":"Switzerland","customers":22,"invoices":123,"net_gbp":99403.06,"share":0.005271824260270078},{"country":"Spain","customers":41,"invoices":188,"net_gbp":91013.44,"share":0.0048268822006348215},{"country":"Sweden","customers":19,"invoices":129,"net_gbp":87775.52,"share":0.004655159668060734},{"country":"Denmark","customers":12,"invoices":53,"net_gbp":64459.59,"share":0.003418603314315098},{"country":"Belgium","customers":29,"invoices":183,"net_gbp":63208.89,"share":0.0033522726540485023},{"country":"Portugal","customers":24,"invoices":124,"net_gbp":51403.68,"share":0.0027261853638223983},{"country":"Channel Islands","customers":14,"invoices":79,"net_gbp":41080.18,"share":0.002178680309642998},{"country":"Japan","customers":10,"invoices":56,"net_gbp":39662.1,"share":0.0021034726797470615}],"country_other":{"countries":29,"net_gbp":273045.45,"share":0.014480918670575734},"months":["2009-12","2010-01","2010-02","2010-03","2010-04","2010-05","2010-06","2010-07","2010-08","2010-09","2010-10","2010-11","2010-12","2011-01","2011-02","2011-03","2011-04","2011-05","2011-06","2011-07","2011-08","2011-09","2011-10","2011-11","2011-12"],"rhythm":{"hour":[6,7,8,9,10,11,12,13,14,15,16,17,18,19,20],"lines":[[0,155,2923,14673,16597,18530,24569,25877,21922,22293,16126,13133,1917,0,0],[0,253,2907,13143,15200,18347,27348,25951,23162,25012,18981,10915,3964,284,8],[0,180,3385,11430,14522,18865,26596,23256,22817,23955,16046,11039,158,14,18],[1,279,2988,13324,16563,17610,24361,24102,23926,19800,17856,10346,8805,7781,1862],[0,180,3229,12771,16224,18355,20191,18256,20570,15651,10543,8490,628,88,7],[0,0,0,0,30,4,102,101,56,70,37,0,0,0,0],[0,0,0,80,8602,22017,27278,24552,19801,20591,8645,70,0,0,0]],"sales_gbp":[[0.0,15830.0,90012.0,301584.0,403843.0,372428.0,424289.0,467722.0,373459.0,333385.0,379985.0,232811.0,21018.0,0.0,0.0],[0.0,11442.0,116973.0,337068.0,536991.0,517194.0,498801.0,477883.0,390750.0,483138.0,306324.0,139759.0,48413.0,14628.0,662.0],[0.0,10111.0,87350.0,287424.0,473636.0,415381.0,552585.0,433391.0,396754.0,356072.0,230837.0,114756.0,992.0,2893.0,13031.0],[4.0,15991.0,120463.0,313148.0,488706.0,418750.0,528159.0,401124.0,430018.0,462616.0,299798.0,221880.0,176772.0,107575.0,25175.0],[0.0,21655.0,107154.0,462373.0,431544.0,381563.0,433543.0,351892.0,381842.0,314199.0,159144.0,105357.0,15878.0,373.0,19.0],[0.0,0.0,0.0,0.0,1060.0,230.0,2111.0,2520.0,1131.0,1600.0,1151.0,0.0,0.0,0.0,0.0],[0.0,0.0,0.0,2853.0,172919.0,317775.0,345641.0,345354.0,242468.0,277607.0,80185.0,371.0,0.0,0.0,0.0]],"weekday":["Mon","Tue","Wed","Thu","Fri","Sat","Sun"]},"schema_version":"v1","series":{"active_customers":[951,701,771,1051,939,965,1034,924,910,1136,1492,1606,884,739,757,973,853,1054,990,946,933,1259,1361,1660,614],"guest_revenue_share":[0.1714,0.1479,0.0822,0.1701,0.0509,0.0903,0.1599,0.0217,0.1062,0.0853,0.077,0.2031,0.2603,0.1517,0.1237,0.1517,0.1364,0.104,0.1205,0.1574,0.0973,0.0867,0.0898,0.2262,0.2107],"invoices":[1666,1049,1189,1647,1435,1484,1612,1507,1402,1789,2244,2719,1550,1081,1093,1440,1235,1668,1525,1452,1339,1818,2005,2751,816],"nonproduct_net_gbp":[18305.42,17647.71,5931.14,11145.11,-48388.98,6971.58,6945.14,-42524.54,-6865.73,9549.26,-27261.03,22202.92,-11366.89,-20406.63,-2421.49,2809.79,10312.49,-8874.48,-33867.91,3419.46,-19883.73,6263.52,7670.3,29024.55,-7677.21],"product_net_gbp":[778343.08,604831.79,525334.23,752102.13,636315.67,606299.14,670128.73,615858.23,661640.12,841556.7,1068946.64,1394494.28,758090.5,578855.19,499447.9,679204.19,482055.35,730968.58,723845.14,676737.53,701270.19,1011333.16,1061697.93,1427121.25,440396.27],"refunds_gbp":[-19558.08,-7465.63,-12575.44,-9603.85,-10025.26,-37192.89,-26336.86,-17132.73,-12397.6,-27686.42,-25451.07,-35098.98,-17547.86,-91525.05,-8335.52,-10504.3,-33316.06,-8948.23,-13713.84,-11407.26,-22926.57,-16980.64,-41613.03,-24991.44,-174091.36],"sales_gbp":[797901.16,612297.42,537909.67,761705.98,646340.93,643492.03,696465.59,632990.96,674037.72,869243.12,1094397.71,1429593.26,775638.36,670380.24,507783.42,689708.49,515371.41,739916.81,737558.98,688144.79,724196.76,1028313.8,1103310.96,1452112.69,614487.63]},"tags":{"basket":"OBSERVED","countries":"OBSERVED","rhythm":"OBSERVED","series":"OBSERVED"}}
